_id,short_name,name_replace,gn_num,qn_sanity,name_match,gn_link,notes,,,,,
id_129,Muḥammad b. Yaḥyā al-Kisāʾī al-Ṣaġīr,Muḥammad b. Yaḥyā al-Kisāʾī al-Ṣaġīr,NA,NA,NA,NA,,,,,,
id_130,Muḥammad b. Yaḥyā al-Marwazī,Muḥammad b. Yaḥyā al-Marwazī,NA,NA,NA,NA,,,,,,
id_131,Muḥammad b. Yaḥyā al-Quṭʿī,Muḥammad b. Yaḥyā al-Quṭʿī,NA,NA,NA,NA,,,,,,
id_132,Muḥammad b. Yaḥyā al-Ḫunaysī,Muḥammad b. Yaḥyā al-Ḫunaysī,NA,NA,NA,NA,,,,,,
id_133,Muḥammad b. Yūnus al-Ḥaḍramī,Muḥammad b. Yūnus al-Ḥaḍramī,NA,NA,NA,NA,,,,,,
id_134,Muḥammad b. al-Rabīʿ,Muḥammad b. al-Rabīʿ,NA,NA,NA,NA,,,,,,
id_135,Muḥammad b. al-Ǧahm,Muḥammad b. al-Ǧahm,NA,NA,NA,NA,,,,,,
id_136,Muḥammad b. al-Ḥasan b. ʿAlī al-ʾAnṭākī,Muḥammad b. al-Ḥasan b. ʿAlī al-ʾAnṭākī,NA,NA,NA,NA,,,,,,
id_137,Muḥammad b. Šuǧāʿ,Muḥammad b. Šuǧāʿ,NA,NA,NA,NA,,,,,,
id_138,Muḥammad b. Ǧarīr al-Ṭabarī,Muḥammad b. Ǧarīr al-Ṭabarī,NA,NA,NA,NA,,,,,,
id_139,Muḥammad b. Ǧaʿfar al-Firyābī,Muḥammad b. Ǧaʿfar al-Firyābī,NA,NA,NA,NA,,,,,,
id_140,Muḥammad b. ʾAḥmad al-Ḥarrānī,Muḥammad b. ʾAḥmad al-Ḥarrānī,NA,NA,NA,NA,,,,,,
id_141,Muḥammad b. ʾAḥmad b. Wāṣil,Muḥammad b. ʾAḥmad b. Wāṣil,NA,NA,NA,NA,,,,,,
id_142,Muḥammad b. ʾAḥmad b. ʿAlī al-Kātib al-Baġdādī,Muḥammad b. ʾAḥmad b. ʿAlī al-Kātib al-Baġdādī,NA,NA,NA,NA,,,,,,
id_143,Muḥammad b. ʾIbrāhīm al-Ḫawwāṣ,Muḥammad b. ʾIbrāhīm al-Ḫawwāṣ,NA,NA,NA,NA,,,,,,
id_144,Muḥammad b. ʾIdrīs al-Dandānī,Muḥammad b. ʾIdrīs al-Dandānī,NA,NA,NA,NA,,,,,,
id_145,Muḥammad b. ʾIsḥāq b. Muḥammad b. ʿAbd al-Raḥmān al-Musayyabī,Muḥammad b. ʾIsḥāq b. Muḥammad b. ʿAbd al-Raḥmān al-Musayyabī,NA,NA,NA,NA,,,,,,
id_146,Muḥammad b. ʿAbd Allāh al-Ḥarbī,Muḥammad b. ʿAbd Allāh al-Ḥarbī,NA,NA,NA,NA,,,,,,
id_147,Muḥammad b. ʿAbd Allāh b. Fulayḥ al-Madanī,Muḥammad b. ʿAbd Allāh b. Fulayḥ al-Madanī,NA,NA,NA,NA,,,,,,
id_148,Muḥammad b. ʿAbd Allāh b. ʾUštah al-ʾIṣbahānī,Muḥammad b. ʿAbd Allāh b. ʾUštah al-ʾIṣbahānī,NA,NA,NA,NA,,,,,,
id_149,Muḥammad b. ʿAbd al-Raḥīm al-ʾIṣbahānī,Muḥammad b. ʿAbd al-Raḥīm al-ʾIṣbahānī,NA,NA,NA,NA,,,,,,
id_150,Muḥammad b. ʿAmr b. Al-ʿAbbās ʾAbū Bakr al-Bāhilī,Muḥammad b. ʿAmr b. Al-ʿAbbās ʾAbū Bakr al-Bāhilī,NA,NA,NA,NA,,,,,,
id_151,Muḥammad b. ʿAmr b. ʿAwn al-Wāsiṭī,Muḥammad b. ʿAmr b. ʿAwn al-Wāsiṭī,NA,NA,NA,NA,,,,,,
id_152,Muḥammad b. ʿImrān al-Dīnawarī,Muḥammad b. ʿImrān al-Dīnawarī,NA,NA,NA,NA,,,,,,
id_153,Muḥammad b. ʿĪsā b. Rāzī al-Taymī al-ʾIṣbahānī,Muḥammad b. ʿĪsā b. Rāzī al-Taymī al-ʾIṣbahānī,NA,NA,NA,NA,,,,,,
id_154,Muḥammad b. Ḥamdūn al-Ḥaḏḏāʾ,Muḥammad b. Ḥamdūn al-Ḥaḏḏāʾ,NA,NA,NA,NA,,,,,,
id_155,Muḥammad b. Ḫalaf al-Taymī,Muḥammad b. Ḫalaf al-Taymī,NA,NA,NA,NA,,,,,,
id_156,Mūsā b. ʾIsḥāq al-Qāḍī,Mūsā b. ʾIsḥāq al-Qāḍī,NA,NA,NA,NA,,,,,,
id_157,Mūsā b. Ḥizām al-Tirmiḏī,Mūsā b. Ḥizām al-Tirmiḏī,NA,NA,NA,NA,,,,,,
id_158,Nuṣayr b. Yūsuf al-Rāzī,Nuṣayr b. Yūsuf al-Rāzī,NA,NA,NA,NA,,,,,,
id_159,Nāfiʿ b. ʾAbī Nuʿaym ʿAbd al-Raḥmān,Nāfiʿ b. ʾAbī Nuʿaym ʿAbd al-Raḥmān,NA,NA,NA,NA,,,,,,
id_160,Qunbul al-Makkī,Qunbul al-Makkī,NA,NA,NA,NA,,,,,,
id_161,Qutaybah b. Mihrān al-ʾAzāḏānī al-ʾIṣbahānī,Qutaybah b. Mihrān al-ʾAzāḏānī al-ʾIṣbahānī,NA,NA,NA,NA,,,,,,
id_162,Qālūn ʾAbū Mūsā,Qālūn ʾAbū Mūsā,NA,NA,NA,NA,,,,,,
id_163,RAW7 B. Al-FARAJ,rawḥ b. al-faraǧ al-miṣrī,NA,NA,NA,NA,mentioned three times in GN: https://tabadil.com/?nasab=%D8%B1%D9%88%D8%AD+%D8%A8%D9%86+%D8%A7%D9%84%D9%81%D8%B1%D8%AC&text_ids=5109,,,,,
id_164,Salāmah b. Hārūn,Salāmah b. Hārūn,NA,NA,NA,NA,,,,,,
id_165,Some of our teachers,ANON_4,NA,NA,NA,NA,,,,,,
id_166,Sulaym b. ʿĪsā b. Sulaym,Sulaym b. ʿĪsā b. Sulaym,NA,NA,NA,NA,,,,,,
id_167,Sulaymān b. Dāwūd al-Hāšimī,Sulaymān b. Dāwūd al-Hāšimī,NA,NA,NA,NA,,,,,,
id_168,Sulaymān b. ʿAbd al-Raḥmān al-Ṭalḥī,Sulaymān b. ʿAbd al-Raḥmān al-Ṭalḥī,NA,NA,NA,NA,,,,,,
id_169,THE BOOK OF ABD ALLAH B. AHMAD B. ISHAQ AL-ASBAHANI,ʿabd allāh b. ʾaḥmad b. ʾisḥāq al-ʾiṣbahānī,NA,NA,NA,NA,The father of Abū Nuʿaym al-ʾIṣfahānī (ʾaḥmad b. ʿabd allāh b. ʾaḥmad b. ʾisḥāq)?,,,,,
id_170,ʾAḥmad b. Wāṣil,ʾaḥmad b. wāṣil al-baġdādī,684,T,NA,https://dlib.nyu.edu/aco/book/cornell_aco000443/143,,,,,,
id_171,UBAYD ALLAH B. MUHAMMAD AL-UMARI AL-QADI,ʿubayd allāh b. muḥammad al-ʿumarī al-qāḍī,NA,NA,NA,NA,mentioned three times in GN: https://tabadil.com/?nasab=%D8%B9%D8%A8%D9%8A%D8%AF+%D8%A7%D9%84%D9%84%D9%87+%D8%A8%D9%86+%D9%85%D8%AD%D9%85%D8%AF&nisbas=%D8%A7%D9%84%D8%B9%D9%85%D8%B1%D9%8A&text_ids=5109,,,,,
id_172,UBAYD B. NU3AYM AL-SA3IDI,ʿubayd b. nuʿaym al-saʿīdī ṣāḥib al-ʾaʿšā,NA,NA,NA,NA,mentioned once in GN: https://tabadil.com/?nasab=%D8%B9%D8%A8%D9%8A%D8%AF+%D8%A8%D9%86+%D9%86%D8%B9%D9%8A%D9%85&nisbas=%D8%A7%D9%84%D8%B3%D8%B9%D9%8A%D8%AF%D9%8A&text_ids=5109,,,,,
id_173,USAMAH AL-TUJIBI,ʾaḥmad b. ʾusāmah b. samḥ al-tuǧībī,156,T,bios_587,https://dlib.nyu.edu/aco/book/cornell_aco000443/42,,,,,,
id_174,Wahb b. Zaʿmah b. Ṣāliḥ,wahb b. zumʿah b. ṣāliḥ al-makkī,3810,T,NA,https://dlib.nyu.edu/aco/book/cornell_aco000444/365,Son of id_182; also the maternal uncle of ʿabd al-malik b. ʿabd allāh b. šuʿūbah ʾabū al-walīd al-ǧiddī (?) al-makkī (1961): https://tabadil.com/reader/5109/479?highlights=%D9%88%D9%87%D8%A8%20%D8%A8%D9%86%20%D8%B2%D9%85%D8%B9%D8%A9%20%D8%A8%D9%86%20%D8%B5%D8%A7%D9%84%D8%AD,,,,,
id_175,YAHYA B. AHMAD B. HARUN AL-MUZAWWIQ,yaḥyā b. ʾaḥmad b. hārūn al-baġdādī yuʿraf bi-ḥayyūn al-muzawwiq,3826,T,NA,https://dlib.nyu.edu/aco/book/cornell_aco000444/371,contemporary of the other al-muzawwiq: https://tabadil.com/reader/5109/271?highlights=%D9%88%D9%8A%D8%AD%D9%8A%D9%89%20%D8%A8%D9%86%20%D8%A3%D8%AD%D9%85%D8%AF%20%D8%A8%D9%86%20%D9%87%D8%A7%D8%B1%D9%88%D9%86,NA,,,,
id_176,YAHYA B. SULAYMAN B. YAHYA B. SAID B. MUSLIM B. UBAYD IBN MUSLIM AL-JU3FI IBN BINT ABI MUSLIM QA'ID AL-A3MASH,yaḥyā b. sulaymān b. yaḥyā b. saʿīd b. muslim b. ʿubayd b. muslim ʾabū saʿīd al-ǧuʿfī al-kūfī,3849,T,NA,https://dlib.nyu.edu/aco/book/cornell_aco000444/377,,,,,,
id_177,Yaḥyā b. al-Ḥāriṯ al-Ḏamārī,Yaḥyā b. al-Ḥāriṯ al-Ḏamārī,NA,NA,NA,NA,,,,,,
id_178,Yaḥyā b. ʾĀdam,Yaḥyā b. ʾĀdam,NA,NA,NA,NA,,,,,,
id_179,Yūnus b. ʿAbd al-ʾAʿlā,Yūnus b. ʿAbd al-ʾAʿlā,NA,NA,NA,NA,,,,,,
id_180,ZAM3AH B. SALIH,zumʿah b. ṣāliḥ ʾabū wahb al-makkī,1297,T,NA,https://dlib.nyu.edu/aco/book/cornell_aco000443/291,father of id_176,,,,,
id_181,al-Faḍl b. Zakarīyāʾ al-Ǧarǧarāʾī,al-Faḍl b. Zakariyyāʾ al-Ǧarǧarāʾī,NA,NA,NA,NA,,,,,,
id_182,al-Mufaḍḍal b. Muḥammad al-Ḍabbī,al-Mufaḍḍal b. Muḥammad al-Ḍabbī,NA,NA,NA,NA,,,,,,
id_183,al-Qāsim b. ʾAḥmad al-Ḫayyāṭ,al-Qāsim b. ʾAḥmad al-Ḫayyāṭ,NA,NA,NA,NA,,,,,,
id_184,al-Qāsim b. ʿAbd al-Wāriṯ,al-Qāsim b. ʿAbd al-Wāriṯ,NA,NA,NA,NA,,,,,,
id_185,al-Walīd b. Muslim,al-Walīd b. Muslim,NA,NA,NA,NA,,,,,,
id_186,al-Walīd b. ʿUtbah al-ʾAšǧaʿī,al-Walīd b. ʿUtbah al-ʾAšǧaʿī,NA,NA,NA,NA,,,,,,
id_187,al-mu3la,al-muʿallā,NA,NA,NA,NA,,,,,,
id_188,al-ʿAbbās b. al-Walīd b. Mazīd,al-ʿAbbās b. al-Walīd b. Mazīd,NA,NA,NA,NA,,,,,,
id_189,al-ʿAbbās b. al-Walīd b. Mirdās,al-ʿAbbās b. al-Walīd b. Mirdās,NA,NA,NA,NA,,,,,,
id_190,al-Ḥasan b. Rašīq,al-Ḥasan b. Rašīq,NA,NA,NA,NA,,,,,,
id_191,al-Ḥasan b. al-Mubārak,al-Ḥasan b. al-Mubārak,NA,NA,NA,NA,,,,,,
id_192,al-Ḥasan b. al-Qāsim,al-Ḥasan b. al-Qāsim,NA,NA,NA,NA,,,,,,
id_193,al-Ḥasan b. al-Sarī b. Sahl,al-Ḥasan b. al-Sarī b. Sahl,NA,NA,NA,NA,,,,,,
id_194,al-Ḥasan b. al-ʿAbbās b. ʾAbī Mihrān al-Ǧammāl al-Rāzī,al-Ḥasan b. al-ʿAbbās b. ʾAbī Mihrān al-Ǧammāl al-Rāzī,NA,NA,NA,NA,,,,,,
id_195,al-Ḥasan b. al-Ḥubāb al-Daqqāq,al-Ḥasan b. al-Ḥubāb al-Daqqāq,NA,NA,NA,NA,,,,,,
id_196,al-Ḥasan b. ʿAlī b. Mālik al-ʾUšnānī,al-Ḥasan b. ʿAlī b. Mālik al-ʾUšnānī,NA,NA,NA,NA,,,,,,
id_197,al-Ḥusayn b. Šarīk,al-Ḥusayn b. Šarīk,NA,NA,NA,NA,,,,,,
id_198,Šibl b. ʿAbbād,Šibl b. ʿAbbād,NA,NA,NA,NA,,,,,,
id_199,Šuǧāʿ b. ʾAbī Naṣr al-Balḫī,Šuǧāʿ b. ʾAbī Naṣr al-Balḫī,NA,NA,NA,NA,,,,,,
id_200,Šuʿayb b. ʾAbī Murrah,Šuʿayb b. ʾAbī Murrah,NA,NA,NA,NA,,,,,,
id_201,Ǧabalah b. Mālik al-Baṣrī,Ǧabalah b. Mālik al-Baṣrī,NA,NA,NA,NA,,,,,,
id_202,Ǧaʿfar b. Muḥammad al-ʾĀdamī,Ǧaʿfar b. Muḥammad al-ʾĀdamī,NA,NA,NA,NA,,,,,,
id_203,Ǧaʿfar b. Muḥammad b. ʾAsad al-Niṣībī Ibn Ḥammāmī,Ǧaʿfar b. Muḥammad b. ʾAsad al-Niṣībī Ibn Ḥammāmī,NA,NA,NA,NA,,,,,,
id_204,Ǧaʿfar b. Muḥammad b. Ḥarb,Ǧaʿfar b. Muḥammad b. Ḥarb,NA,NA,NA,NA,,,,,,
id_205,Ǧaʿfar b. Sulaymān al-Mišḥalāʾī,Ǧaʿfar b. Sulaymān al-Mišḥalāʾī,NA,NA,NA,NA,,,,,,
id_206,Ǧaʿfar b. ʿAnbasah,Ǧaʿfar b. ʿAnbasah,NA,NA,NA,NA,,,,,,
id_207,ʾAbū Bakr Muḥammad b. al-Faraǧ,ʾAbū Bakr Muḥammad b. al-Faraǧ,NA,NA,NA,NA,,,,,,
id_208,ʾAbū Bakr Muḥammad b. ʾAḥmad al-Dāǧūnī al-Kabīr,ʾAbū Bakr Muḥammad b. ʾAḥmad al-Dāǧūnī al-Kabīr,NA,NA,NA,NA,,,,,,
id_209,ʾAbū Bakr Muḥammad b. ʿAlī b. al-Ḥasan al-Ǧulandā,ʾAbū Bakr Muḥammad b. ʿAlī b. al-Ḥasan al-Ǧulandā,NA,NA,NA,NA,,,,,,
id_210,ʾAbū Bakr b. Muǧāhid,ʾAbū Bakr b. Muǧāhid,NA,NA,NA,NA,,,,,,
id_211,ʾAbū Bakr b. Ziyād al-Naqqāš,ʾAbū Bakr b. Ziyād al-Naqqāš,NA,NA,NA,NA,,,,,,
id_212,ʾAbū Bakr b. ʿAyyāš,ʾAbū Bakr b. ʿAyyāš,NA,NA,NA,NA,,,,,,
id_213,ʾAbū Bakr ʾAḥmad b. Manṣūr,ʾAbū Bakr ʾAḥmad b. Manṣūr,NA,NA,NA,NA,,,,,,
id_214,ʾAbū Bakr ʿAbd Allāh b. Mālik b. Sayf,ʾAbū Bakr ʿAbd Allāh b. Mālik b. Sayf,NA,NA,NA,NA,,,,,,
id_215,ʾAbū Hišām Muḥammad b. Yazīd b. Rifāʿah,ʾAbū Hišām Muḥammad b. Yazīd b. Rifāʿah,NA,NA,NA,NA,,,,,,
id_216,ʾAbū Marwān ʿUbayd Allāh b. Salamah b. Ḥazm al-Yaḥṣubī al-ʾAndalusī,ʾAbū Marwān ʿUbayd Allāh b. Salamah b. Ḥazm al-Yaḥṣubī al-ʾAndalusī,NA,NA,NA,NA,,,,,,
id_217,ʾAbū Muḥammad Yaḥyā b. al-Mubārak al-Yazīdī,ʾAbū Muḥammad Yaḥyā b. al-Mubārak al-Yazīdī,NA,NA,NA,NA,,,,,,
id_218,ʾAbū Muḥammad b. ʿAbd Allāh b. Muḥammad,ʾAbū Muḥammad b. ʿAbd Allāh b. Muḥammad,NA,NA,NA,NA,,,,,,
id_219,ʾAbū Muḥammad ʿUbayd b. Muḥammad al-Marwazī al-Mukattib,ʾAbū Muḥammad ʿUbayd b. Muḥammad al-Marwazī al-Mukattib,NA,NA,NA,NA,,,,,,
id_220,ʾAbū Mūsā ʾIsḥāq b. Mūsā al-ʾAnṣārī,ʾAbū Mūsā ʾIsḥāq b. Mūsā al-ʾAnṣārī,NA,NA,NA,NA,,,,,,
id_221,ʾAbū Našīṭ Muḥammad b. Hārūn,ʾAbū Našīṭ Muḥammad b. Hārūn,NA,NA,NA,NA,,,,,,
id_222,ʾAbū Rabīʿah Muḥammad b. ʾIsḥāq b. ʾAʿyān al-Rabaʿī,ʾAbū Rabīʿah Muḥammad b. ʾIsḥāq b. ʾAʿyān al-Rabaʿī,NA,NA,NA,NA,,,,,,
id_223,ʾAbū Yaʿqūb Yūsuf b. Ǧaʿfar b. ʿAbd Allāh b. Maʿrūf,ʾAbū Yaʿqūb Yūsuf b. Ǧaʿfar b. ʿAbd Allāh b. Maʿrūf,NA,NA,NA,NA,,,,,,
id_224,ʾAbū Yaʿqūb al-ʾAzraq,ʾAbū Yaʿqūb al-ʾAzraq,NA,NA,NA,NA,,,,,,
id_225,ʾAbū Yaʿqūb ʾIsḥāq b. ʾIbrāhīm b. ʾAbī Ḥassān al-ʾAnmāṭī al-Baġdādī,ʾAbū Yaʿqūb ʾIsḥāq b. ʾIbrāhīm b. ʾAbī Ḥassān al-ʾAnmāṭī al-Baġdādī,NA,NA,NA,NA,,,,,,
id_226,ʾAbū Yūsuf Yaʿqūb al-ʾAʿšā,ʾAbū Yūsuf Yaʿqūb al-ʾAʿšā,NA,NA,NA,NA,,,,,,
id_227,ʾAbū Zayd al-ʾAnṣārī Saʿīd b. ʾAws,ʾAbū Zayd al-ʾAnṣārī Saʿīd b. ʾAws,NA,NA,NA,NA,,,,,,
id_228,ʾAbū al-Fatḥ Fāris b. ʾAḥmad b. Ḍarīr,ʾAbū al-Fatḥ Fāris b. ʾAḥmad b. Ḍarīr,NA,NA,NA,NA,,,,,,
id_229,ʾAbū al-Rabīʿ Sulaymān b. Dāwūd al-Zahrānī,ʾAbū al-Rabīʿ Sulaymān b. Dāwūd al-Zahrānī,NA,NA,NA,NA,,,,,,
id_230,ʾAbū al-Zaʿrāʾ ʿAbd al-Raḥmān b. ʿAbdūs,ʾAbū al-Zaʿrāʾ ʿAbd al-Raḥmān b. ʿAbdūs,NA,NA,NA,NA,,,,,,
id_231,ʾAbū al-ʾIḫrīṭ Wahb b. Wāḍiḥ,ʾAbū al-ʾIḫrīṭ Wahb b. Wāḍiḥ,NA,NA,NA,NA,,,,,,
id_232,ʾAbū al-ʿAbbās al-Ḥasan b. Saʿīd al-Muṭṭawwiʿī al-ʿĀbbādānī,ʾAbū al-ʿAbbās al-Ḥasan b. Saʿīd al-Muṭṭawwiʿī al-ʿĀbbādānī,NA,NA,NA,NA,,,,,,
id_233,ʾAbū al-Ḥasan ʾAḥmad b. Muḥammad b. ʿAbd Allāh al-Bazzī,ʾAbū al-Ḥasan ʾAḥmad b. Muḥammad b. ʿAbd Allāh al-Bazzī,NA,NA,NA,NA,,,,,,
id_234,ʾAbū al-Ḥasan ʾAḥmad b. Muḥammad b. ʿAlqamah al-Qawwās al-Nabbāl,ʾAbū al-Ḥasan ʾAḥmad b. Muḥammad b. ʿAlqamah al-Qawwās al-Nabbāl,NA,NA,NA,NA,,,,,,
id_235,ʾAbū al-Ḥasan ʿAlī b. Ḥamzah al-Kisāʾī,ʾAbū al-Ḥasan ʿAlī b. Ḥamzah al-Kisāʾī,NA,NA,NA,NA,,,,,,
id_236,ʾAbū al-Ḥasan Ṭāhir b. ʿAbd al-Munʿim b. ʿUbayd Allāh b. Ġalbūn,ʾAbū al-Ḥasan Ṭāhir b. ʿAbd al-Munʿim b. ʿUbayd Allāh b. Ġalbūn,NA,NA,NA,NA,,,,,,
id_237,ʾAbū al-Ḥassān ʾAḥmad b. Muḥammad b. ʾAbī al-ʾAšʿaṯ Yazīd al-ʿAnazī,ʾAbū al-Ḥassān ʾAḥmad b. Muḥammad b. ʾAbī al-ʾAšʿaṯ Yazīd al-ʿAnazī,NA,NA,NA,NA,,,,,,
id_238,ʾAbū al-Ḥusayn ʾAḥmad b. ʿUṯmān b. Būyān,ʾAbū al-Ḥusayn ʾAḥmad b. ʿUṯmān b. Būyān,NA,NA,NA,NA,,,,,,
id_239,ʾAbū al-Ḥāriṯ Salamah b. ʿĀṣim,ʾAbū al-Ḥāriṯ Salamah b. ʿĀṣim,NA,NA,NA,NA,,,,,,
id_240,ʾAbū al-Ḥāriṯ al-Layṯ b. Ḫālid,ʾAbū al-Ḥāriṯ al-Layṯ b. Ḫālid,NA,NA,NA,NA,,,,,,
id_241,ʾAbū Šuʿayb al-Qawwās al-Baġdādī,ʾAbū Šuʿayb al-Qawwās al-Baġdādī,NA,NA,NA,NA,,,,,,
id_242,ʾAbū Šuʿayb al-Sūsī,ʾAbū Šuʿayb al-Sūsī,NA,NA,NA,NA,,,,,,
id_243,ʾAbū Ǧaʿfar Muḥammad b. ʿĪsā b. Ḥayyān al-Baġdādī,ʾAbū Ǧaʿfar Muḥammad b. ʿĪsā b. Ḥayyān al-Baġdādī,NA,NA,NA,NA,,,,,,
id_244,ʾAbū Ǧaʿfar Muḥammad b. Ḥabīb al-Šummūnī,ʾAbū Ǧaʿfar Muḥammad b. Ḥabīb al-Šummūnī,NA,NA,NA,NA,,,,,,
id_245,ʾAbū Ǧaʿfar ʾAḥmad b. ʿAlī b. Fuḍayl al-Ḫazzāz,ʾAbū Ǧaʿfar ʾAḥmad b. ʿAlī b. Fuḍayl al-Ḫazzāz,NA,NA,NA,NA,,,,,,
id_246,ʾAbū ʾAyyūb Sulaymān b. al-Ḥakam al-Ḫayyāṭ,ʾAbū ʾAyyūb Sulaymān b. al-Ḥakam al-Ḫayyāṭ,NA,NA,NA,NA,,,,,,
id_247,ʾAbū ʾAḥmad ʿAbd Allāh b. al-Ḥusayn b. Ḥasnūn al-Sāmarrī,ʾAbū ʾAḥmad ʿAbd Allāh b. al-Ḥusayn b. Ḥasnūn al-Sāmarrī,NA,NA,NA,NA,,,,,,
id_248,ʾAbū ʾUmayyah,ʾAbū ʾUmayyah,NA,NA,NA,NA,,,,,,
id_249,ʾAbū ʿAbd Allāh ʾAḥmad b. ʿAbd Rabbih b. ʿAbbās,ʾAbū ʿAbd Allāh ʾAḥmad b. ʿAbd Rabbih b. ʿAbbās,NA,NA,NA,NA,,,,,,
id_250,ʾAbū ʿAbd al-Raḥmān Ibn al-Yazīdī,ʾAbū ʿAbd al-Raḥmān Ibn al-Yazīdī,NA,NA,NA,NA,,,,id_273,####,####
id_251,ʾAbū ʿAbd al-Raḥmān al-Lahabī,ʾAbū ʿAbd al-Raḥmān al-Lahabī,NA,NA,NA,NA,,,,,,
id_252,ʾAbū ʿAlī al-Ḥasan b. Dāwūd al-Naqqār,ʾAbū ʿAlī al-Ḥasan b. Dāwūd al-Naqqār,NA,NA,NA,NA,,,,,,
id_253,ʾAbū ʿAlī al-Ḥusayn b. Ḥabīb al-Ḥaṣāʾirī,ʾAbū ʿAlī al-Ḥusayn b. Ḥabīb al-Ḥaṣāʾirī,NA,NA,NA,NA,,,,,,
id_254,ʾAbū ʿAlī ʾAḥmad b. Muḥammad al-ʾIṣbahānī,ʾAbū ʿAlī ʾAḥmad b. Muḥammad al-ʾIṣbahānī,NA,NA,NA,NA,,,,,,
id_255,ʾAbū ʿUmārah Ḥamzah b. al-Qāsim al-ʾAḥwal,ʾAbū ʿUmārah Ḥamzah b. al-Qāsim al-ʾAḥwal,NA,NA,NA,NA,,,,,,
id_256,ʾAbū ʿAmr b. al-ʿAlāʾ,ʾAbū ʿAmr b. al-ʿAlāʾ,NA,NA,NA,NA,,,,,,
id_257,ʾAbū ʿUbayd al-Qāsim b. Sallām,ʾAbū ʿUbayd al-Qāsim b. Sallām,NA,NA,NA,NA,,,,,,
id_258,ʾAbū ʿUmar al-Dūrī,ʾAbū ʿUmar al-Dūrī,NA,NA,NA,NA,,,,,,
id_259,ʾAbū ʿUṯmān Saʿīd b. ʿAbd al-Raḥīm b. ʿUṯmān al-Ḍarīr,ʾAbū ʿUṯmān Saʿīd b. ʿAbd al-Raḥīm b. ʿUṯmān al-Ḍarīr,NA,NA,NA,NA,,,,,,
id_260,ʾAbū Ḥamdūn al-Ṭayyib b. ʾIsmāʿīl,ʾAbū Ḥamdūn al-Ṭayyib b. ʾIsmāʿīl,NA,NA,NA,NA,,,,,,
id_261,ʾAbū Ḫallād Sulaymān b. Ḫallād,ʾAbū Ḫallād Sulaymān b. Ḫallād,NA,NA,NA,NA,,,,,,
id_262,ʾAbū Ṭāhir ʿAbd al-Wāḥid b. ʾAbī Hāšim,ʾAbū Ṭāhir ʿAbd al-Wāḥid b. ʾAbī Hāšim,NA,NA,NA,NA,,,,,,
id_263,ʾAyyūb b. Tamīm,ʾAyyūb b. Tamīm,NA,NA,NA,NA,,,,,,
id_264,ʾAḥmad b. Faraḥ al-Mufassir al-Ḍarīr,ʾAḥmad b. Faraḥ al-Mufassir al-Ḍarīr,NA,NA,NA,NA,,,,,,
id_265,ʾAḥmad b. Munīʿ,ʾAḥmad b. Munīʿ,NA,NA,NA,NA,,,,,,
id_266,ʾAḥmad b. Muḥammad b. Zakarīyāʾ al-Ṣadafī,ʾAḥmad b. Muḥammad b. Zakariyyāʾ al-Ṣadafī,NA,NA,NA,NA,,,,,,
id_267,ʾAḥmad b. Muḥammad b. ʾAbī al-Raǧāʾ,ʾAḥmad b. Muḥammad b. ʾAbī al-Raǧāʾ,NA,NA,NA,NA,,,,,,
id_268,ʾAḥmad b. Muḥammad b. Ḥawṯarah al-ʾAṣamm,ʾAḥmad b. Muḥammad b. Ḥawṯarah al-ʾAṣamm,NA,NA,NA,NA,,,,,,
id_269,ʾAḥmad b. Muḥammad b. Ṣadaqah,ʾAḥmad b. Muḥammad b. Ṣadaqah,NA,NA,NA,NA,,,,,,
id_270,ʾAḥmad b. Naṣr b. Šākir,ʾaḥmad b. naṣr b. šākir b. ʾabī raǧāʾ ʿammār ʾabū al-ḥasan al-dimašqī,672,T,,https://dlib.nyu.edu/aco/book/cornell_aco000443/140,,,,,,
id_271,ʾAḥmad b. Qālūn ʾAbū Mūsā,ʾAḥmad b. Qālūn ʾAbū Mūsā,NA,NA,NA,NA,,,,,,
id_272,ʾAḥmad b. Rustam al-Ṭabarī,ʾAḥmad b. Rustam al-Ṭabarī,NA,NA,NA,NA,,,,,,
id_273,ʾAḥmad b. Sahl al-ʾUšnānī,ʾAḥmad b. Sahl al-ʾUšnānī,NA,NA,NA,NA,,,,,,
id_274,ʾAḥmad b. Saʿīd b. Šāhīn,ʾAḥmad b. Saʿīd b. Šāhīn,NA,NA,NA,NA,,,,,,
id_275,ʾAḥmad b. Yazīd al-Ḥulwānī,ʾAḥmad b. Yazīd al-Ḥulwānī,NA,NA,NA,NA,,,,,,
id_276,ʾAḥmad b. Yaʿqūb al-Tāʾib,ʾAḥmad b. Yaʿqūb al-Tāʾib,NA,NA,NA,NA,,,,,,
id_277,ʾAḥmad b. Yūsuf al-Taġlibī,ʾAḥmad b. Yūsuf al-Taġlibī,NA,NA,NA,NA,,,,,,
id_278,ʾAḥmad b. Zuhayr b. Ḥarb ʾAbū Bakr,ʾAḥmad b. Zuhayr b. Ḥarb ʾAbū Bakr,NA,NA,NA,NA,,,,,,
id_279,ʾAḥmad b. al-Ṣaqr al-Manbiǧī,ʾAḥmad b. al-Ṣaqr al-Manbiǧī,NA,NA,NA,NA,,,,,,
id_280,ʾAḥmad b. Ǧubayr al-ʾAnṭākī,ʾAḥmad b. Ǧubayr al-ʾAnṭākī,NA,NA,NA,NA,,,,,,
id_281,ʾAḥmad b. ʾAnas b. Mālik ʾAbū al-Ḥasan al-Dimašqī,ʾAḥmad b. ʾAnas b. Mālik ʾAbū al-Ḥasan al-Dimašqī,NA,NA,NA,NA,,,,,,
id_282,ʾAḥmad b. ʾIbrāhīm b. Ǧāmiʿ al-Sukkarī,ʾAḥmad b. ʾIbrāhīm b. Ǧāmiʿ al-Sukkarī,NA,NA,NA,NA,,,,,,
id_283,ʾAḥmad b. ʾUsāmah al-Tuǧībī,ʾAḥmad b. ʾUsāmah al-Tuǧībī,NA,NA,NA,NA,,,,,,
id_284,ʾAḥmad b. ʿAbd Allāh b. Muḥammad b. Hilāl al-ʾAzdī,ʾAḥmad b. ʿAbd Allāh b. Muḥammad b. Hilāl al-ʾAzdī,NA,NA,NA,NA,,,,,,
id_285,ʾAḥmad b. ʿUbayd Allāh al-Maḫzūmī,ʾAḥmad b. ʿUbayd Allāh al-Maḫzūmī,NA,NA,NA,NA,,,,,,
id_286,ʾAḥmad b. ʿUmar al-Wakīʿī,ʾAḥmad b. ʿUmar al-Wakīʿī,NA,NA,NA,NA,,,,,,
id_287,ʾAḥmad b. Ṣāliḥ al-Miṣrī,ʾAḥmad b. Ṣāliḥ al-Miṣrī,NA,NA,NA,NA,,,,,,
id_288,ʾIbrāhīm b. Muḥammad b. Marwān,ʾIbrāhīm b. Muḥammad b. Marwān,NA,NA,NA,NA,,,,,,
id_289,ʾIbrāhīm b. Zarbī,ʾIbrāhīm b. Zarbī,NA,NA,NA,NA,,,,,,
id_290,ʾIbrāhīm b. Ǧaʿfar,ʾIbrāhīm b. Ǧaʿfar,NA,NA,NA,NA,,,,,,
id_291,ʾIbrāhīm b. ʾAḥmad b. ʾIbrāhīm al-Buzūrī,ʾIbrāhīm b. ʾAḥmad b. ʾIbrāhīm al-Buzūrī,NA,NA,NA,NA,,,,,,
id_292,ʾIbrāhīm b. ʿAbd al-Razzāq b. al-Ḥasan al-ʾAnṭākī,ʾIbrāhīm b. ʿAbd al-Razzāq b. al-Ḥasan al-ʾAnṭākī,NA,NA,NA,NA,,,,,,
id_293,ʾIdrīs b. ʿAbd al-Karīm al-Ḥaddād,ʾIdrīs b. ʿAbd al-Karīm al-Ḥaddād,NA,NA,NA,NA,,,,,,
id_294,ʾIsmāʿīl al-Qāḍī,ʾIsmāʿīl al-Qāḍī,NA,NA,NA,NA,,,,,,
id_295,ʾIsmāʿīl b. Ǧaʿfar b. ʾAbī Kaṯīr al-ʾAnṣārī,ʾIsmāʿīl b. Ǧaʿfar b. ʾAbī Kaṯīr al-ʾAnṣārī,NA,NA,NA,NA,,,,,,
id_296,ʾIsmāʿīl b. ʾAbī Muḥammad al-Yazīdī,ʾIsmāʿīl b. ʾAbī Muḥammad al-Yazīdī,NA,NA,NA,NA,,,,,,
id_297,ʾIsmāʿīl b. ʿAbd Allāh al-Naḥḥās al-Miṣrī,ʾIsmāʿīl b. ʿAbd Allāh al-Naḥḥās al-Miṣrī,NA,NA,NA,NA,,,,,,
id_298,ʾIsmāʿīl b. ʿAbd Allāh b. Qusṭanṭīn,ʾIsmāʿīl b. ʿAbd Allāh b. Qusṭanṭīn,NA,NA,NA,NA,,,,,,
id_299,ʾIsḥāq al-ʾAzraq,ʾIsḥāq al-ʾAzraq,NA,NA,NA,NA,,,,,,
id_300,ʾIsḥāq b. Muḥammad b. ʿAbd al-Raḥmān al-Musayyabī,ʾIsḥāq b. Muḥammad b. ʿAbd al-Raḥmān al-Musayyabī,NA,NA,NA,NA,,,,,,
id_301,ʾIsḥāq b. ʾAḥmad al-Ḫuzāʿī,ʾIsḥāq b. ʾAḥmad al-Ḫuzāʿī,NA,NA,NA,NA,,,,,,
id_302,ʿAbd Allāh b. Kaṯīr,ʿAbd Allāh b. Kaṯīr,NA,NA,NA,NA,,,,,,
id_303,ʿAbd Allāh b. Muḥammad al-Ṭūsī al-Kātib,ʿAbd Allāh b. Muḥammad al-Ṭūsī al-Kātib,NA,NA,NA,NA,,,,,,
id_304,ʿAbd Allāh b. Muḥammad b. Šākir,ʿAbd Allāh b. Muḥammad b. Šākir,NA,NA,NA,NA,,,,,,
id_305,ʿAbd Allāh b. Muḥammad b. ʿAbd al-ʿAzīz ʾAbū al-Qāsim al-Baġawī,ʿAbd Allāh b. Muḥammad b. ʿAbd al-ʿAzīz ʾAbū al-Qāsim al-Baġawī,NA,NA,NA,NA,,,,,,
id_306,ʿAbd Allāh b. al-Mubārak,ʿAbd Allāh b. al-Mubārak,NA,NA,NA,NA,,,,,,
id_307,ʿAbd Allāh b. al-Ṣaqr al-Sukkarī,ʿAbd Allāh b. al-Ṣaqr al-Sukkarī,NA,NA,NA,NA,,,,,,
id_308,ʿAbd Allāh b. ʾAḥmad b. Ḏakwān,ʿAbd Allāh b. ʾAḥmad b. Ḏakwān,NA,NA,NA,NA,,,,,,
id_309,ʿAbd Allāh b. ʿAmr b. Bišr b. ʾAbī Saʿd ʾAbū Muḥammad al-Warrāq al-Baġdādī,ʿAbd Allāh b. ʿAmr b. Bišr b. ʾAbī Saʿd ʾAbū Muḥammad al-Warrāq al-Baġdādī,NA,NA,NA,NA,,,,,,
id_310,ʿAbd Allāh b. ʿAṭiyyah b. Ḥabīb al-Dimašqī al-Mufassir,ʿAbd Allāh b. ʿAṭiyyah b. Ḥabīb al-Dimašqī al-Mufassir,NA,NA,NA,NA,,,,,,
id_311,ʿAbd Allāh b. ʿĀmir al-Yaḥṣubī,ʿAbd Allāh b. ʿĀmir al-Yaḥṣubī,NA,NA,NA,NA,,,,,,
id_312,ʿAbd Allāh b. ʿĪsā al-Madanī,ʿAbd Allāh b. ʿĪsā al-Madanī,NA,NA,NA,NA,,,,,,
id_313,ʿAbd al-Bāqī b. al-Ḥasan b. al-Saqqāʾ,ʿAbd al-Bāqī b. al-Ḥasan b. al-Saqqāʾ,NA,NA,NA,NA,,,,,,
id_314,ʿAbd al-Razzāq b. al-Ḥasan al-ʾAnṭākī,ʿAbd al-Razzāq b. al-Ḥasan al-ʾAnṭākī,NA,NA,NA,NA,,,,,,
id_315,ʿAbd al-Raḥmān b. Dāwūd b. ʾAbī Ṭaybah,ʿAbd al-Raḥmān b. Dāwūd b. ʾAbī Ṭaybah,NA,NA,NA,NA,,,,,,
id_316,ʿAbd al-Raḥmān b. ʾAbī Ḥammād,ʿAbd al-Raḥmān b. ʾAbī Ḥammād,NA,NA,NA,NA,,,,,,
id_317,ʿAbd al-Wahhāb b. Fulayḥ al-Makkī,ʿAbd al-Wahhāb b. Fulayḥ al-Makkī,NA,NA,NA,NA,,,,,,
id_318,ʿAbd al-Ǧabbār b. Muḥammad al-ʿUṭāridī,ʿAbd al-Ǧabbār b. Muḥammad al-ʿUṭāridī,NA,NA,NA,NA,,,,,,
id_319,ʿAbd al-ʿAzīz b. ʿAlī b. al-ʾImām,ʿAbd al-ʿAzīz b. ʿAlī b. al-ʾImām,NA,NA,NA,NA,,,,,,
id_320,ʿAbd al-ʿAzīz b. Ḫwāstī al-Fārisī,ʿAbd al-ʿAzīz b. Ḫwāstī al-Fārisī,NA,NA,NA,NA,,,,,,
id_321,ʿAbd al-Ḥamīd b. Bakkār,ʿAbd al-Ḥamīd b. Bakkār,NA,NA,NA,NA,,,,,,
id_322,ʿAbd al-Ḥamīd b. Ṣāliḥ al-Burǧumī,ʿAbd al-Ḥamīd b. Ṣāliḥ al-Burǧumī,NA,NA,NA,NA,,,,,,
id_323,ʿAbd al-Ṣamad b. ʿAbd al-Raḥmān b. al-Qāsim,ʿAbd al-Ṣamad b. ʿAbd al-Raḥmān b. al-Qāsim,NA,NA,NA,NA,,,,,,
id_324,ʿAli b. Mūsā al-Hāšimī,ʿAlī b. Mūsā al-Hāšimī,NA,NA,NA,NA,,,,,,
id_325,ʿAlī b. Kīsah al-Miṣrī,ʿAlī b. Kīsah al-Miṣrī,NA,NA,NA,NA,,,,,,
id_326,ʿAlī b. Muḥammad b. Ṣāliḥ al-Hāšimī al-Baṣrī,ʿAlī b. Muḥammad b. Ṣāliḥ al-Hāšimī al-Baṣrī,NA,NA,NA,NA,,,,,,
id_327,ʿAlī b. Saʿīd b. al-Ḥasan b. Ḏuʿābah al-Qazzāz,ʿAlī b. Saʿīd b. al-Ḥasan b. Ḏuʿābah al-Qazzāz,NA,NA,NA,NA,,,,,,
id_328,ʿAlī b. Yūsuf b. Muḥammad ʾAbū al-Qāsim al-Baṣrī,ʿAlī b. Yūsuf b. Muḥammad ʾAbū al-Qāsim al-Baṣrī,NA,NA,NA,NA,,,,,,
id_329,ʿAlī b. al-Ḥasan al-Qaṭīʿī,ʿAlī b. al-Ḥasan al-Qaṭīʿī,NA,NA,NA,NA,,,,,,
id_330,ʿAlī b. ʾAbī Naṣr al-Naḥwī,ʿAlī b. ʾAbī Naṣr al-Naḥwī,NA,NA,NA,NA,,,,,,
id_331,ʿAlī b. ʾAḥmad b. ʾAbī Qirbah,ʿAlī b. ʾAḥmad b. ʾAbī Qirbah,NA,NA,NA,NA,,,,,,
id_332,ʿAlī b. ʿAbd al-ʿAzīz,ʿAlī b. ʿAbd al-ʿAzīz,NA,NA,NA,NA,,,,,,
id_333,ʿAlī b. Miḥṣan,ʿAlī b. Miḥṣan,NA,NA,NA,NA,,,,,,
id_334,ʿAmr b. al-Ṣabbāḥ,ʿAmr b. al-Ṣabbāḥ,NA,NA,NA,NA,,,,,,
id_335,ʿAtīq b. Mā Šāʾa Allāh al-Miṣrī,ʿAtīq b. Mā Šāʾa Allāh al-Miṣrī,NA,NA,NA,NA,,,,,,
id_336,ʿIkrimah b. Sulaymān,ʿIkrimah b. Sulaymān,NA,NA,NA,NA,,,,,,
id_337,ʿIrāk b. Ḫālid,ʿIrāk b. Ḫālid,NA,NA,NA,NA,,,,,,
id_338,ʿUbayd Allāh b. ʾAbī Muslim Muḥammad al-Faraḍī,ʿUbayd Allāh b. ʾAbī Muslim Muḥammad al-Faraḍī,NA,NA,NA,NA,,,,,,
id_339,ʿUbayd b. Muḥammad al-Bazzāz,ʿUbayd b. Muḥammad al-Bazzāz,NA,NA,NA,NA,,,,,,
id_340,ʿUbayd b. al-Ṣabbāḥ,ʿUbayd b. al-Ṣabbāḥ,NA,NA,NA,NA,,,,,,
id_341,ʿUmar b. Muḥammad b. ʿIrāk,ʿUmar b. Muḥammad b. ʿIrāk,NA,NA,NA,NA,,,,,,
id_342,ʿUmar b. Šabbah al-Numayrī,ʿUmar b. Šabbah al-Numayrī,NA,NA,NA,NA,,,,,,
id_343,ʿUṯmān b. Saʿīd Warš,ʿUṯmān b. Saʿīd Warš,NA,NA,NA,NA,,,,,,
id_344,ʿUṯmān b. Ḫurrazāḏ,ʿUṯmān b. Ḫurrazāḏ,NA,NA,NA,NA,,,,,,
id_345,ʿĀmir b. ʿUmar al-Mawṣilī al-ʾŪqiyyah,ʿĀmir b. ʿUmar al-Mawṣilī al-ʾŪqiyyah,NA,NA,NA,NA,,,,,,
id_346,ʿĀṣim b. ʾAbī al-Naǧūd Bahdalah al-ʾAsadī,ʿĀṣim b. ʾAbī al-Naǧūd Bahdalah al-ʾAsadī,NA,NA,NA,NA,,,,,,
id_347,ʿĪsā b. Wardān al-Ḥaḏḏāʾ,ʿĪsā b. Wardān al-Ḥaḏḏāʾ,NA,NA,NA,NA,,,,,,
id_348,Ḥafṣ b. Sulaymān ʾAbū ʿUmar al-ʾAsadī,Ḥafṣ b. Sulaymān ʾAbū ʿUmar al-ʾAsadī,NA,NA,NA,NA,,,,,,
id_349,Ḥammād b. Baḥr al-Kūfī,Ḥammād b. Baḥr al-Kūfī,NA,NA,NA,NA,,,,,,
